comment_id,status_id,parent_id,comment_message,comment_author,comment_published,num_reactions,num_likes,num_loves,num_wows,num_hahas,num_sads,num_angrys,num_special
10151472549144999_10151472601019999,5281959998_10151472549144999,,I understand  I felt that way about Obuma and his group.,undiscoverable,2018-01-31 19:28:24,0,0,0,0,0,0,0,0
10151472549144999_10151472601974999,5281959998_10151472549144999,,He’s so lost.... so is the clown behind him.,undiscoverable,2018-01-31 19:29:38,0,0,0,0,0,0,0,0
10151472549144999_10151473539554999,5281959998_10151472549144999,,Opinion is the operable word.,undiscoverable,2018-02-01 17:25:10,0,0,0,0,0,0,0,0
10151472549144999_10151472580354999,5281959998_10151472549144999,,that's Stephen Miller speaking in addition to trump,undiscoverable,2018-01-31 19:02:59,1,1,0,0,0,0,0,0
10151472549144999_10151473101699999,5281959998_10151472549144999,,"I’m an immigrant. If squishing a fly is considered violent, then maybe I am a criminal?!? 🤔🤨",undiscoverable,2018-02-01 10:03:08,0,0,0,0,0,0,0,0
10151472549144999_10151472921894999,5281959998_10151472549144999,,May God Have Mercy on Trump Supporters Souls!! 🤦🏾‍♂️🤦🏾‍♂️🤦🏾‍♂️,undiscoverable,2018-02-01 05:34:19,0,0,0,0,0,0,0,0
10151472549144999_10151472862209999,5281959998_10151472549144999,,So there aren't immigrant crime gangs and criminal syndicates?,undiscoverable,2018-02-01 02:05:25,0,0,0,0,0,0,0,0
10151472549144999_10151473660819999,5281959998_10151472549144999,,Do any of you actually look at data? https://papers.ssrn.com/sol3/papers.cfm?abstract_id=3099992,undiscoverable,2018-02-01 20:09:25,0,0,0,0,0,0,0,0
10151472549144999_10151472786914999,5281959998_10151472549144999,,And look at that deer-caught-in-the-headlights look on Ryan’s face. Disgusting.,undiscoverable,2018-01-31 23:26:02,0,0,0,0,0,0,0,0
10151472549144999_10151472749174999,5281959998_10151472549144999,,If it was evil then Miller was behind it.,undiscoverable,2018-01-31 22:17:22,0,0,0,0,0,0,0,0
10151472549144999_10151472577714999,5281959998_10151472549144999,,"You are, no doubt, out of you liberal frigging mind!!!!",undiscoverable,2018-01-31 18:59:51,2,2,0,0,0,0,0,0
10151472549144999_10151472587254999,5281959998_10151472549144999,,Most people loved the speech as much as I did. ❤️,undiscoverable,2018-01-31 19:11:11,4,2,1,0,1,0,0,0
10151472549144999_10151472590184999,5281959998_10151472549144999,10151472549144999_10151472587254999,"Of course, the facts don't support that at all but why let that get in the way?",undiscoverable,2018-01-31 19:14:42,2,1,0,0,1,0,0,0
10151472549144999_10151472788354999,5281959998_10151472549144999,10151472549144999_10151472587254999,"Sonya Ybarra lol what? Have you looked at the polls from his speech?

He got great reviews.",undiscoverable,2018-01-31 23:28:51,0,0,0,0,0,0,0,0
10151472549144999_10151472959709999,5281959998_10151472549144999,,Ryan hopped up on opioids in the background...,undiscoverable,2018-02-01 07:20:57,0,0,0,0,0,0,0,0
10151472549144999_10151472611504999,5281959998_10151472549144999,,Too bad these kids were murdered. This didn't have to happen.,undiscoverable,2018-01-31 19:40:27,0,0,0,0,0,0,0,0
10151472549144999_10151472727459999,5281959998_10151472549144999,,"Yes, MS-13 members are dreamers too.",undiscoverable,2018-01-31 21:53:29,0,0,0,0,0,0,0,0
10151472549144999_10151472705004999,5281959998_10151472549144999,,He should have talked about gun violence by white Americans.,undiscoverable,2018-01-31 21:36:34,0,0,0,0,0,0,0,0
10151472549144999_10151472751574999,5281959998_10151472549144999,,It was a perfectly good speech aimed at unifying America,undiscoverable,2018-01-31 22:21:58,0,0,0,0,0,0,0,0
10151472549144999_10151472625319999,5281959998_10151472549144999,,That shitshow  was awful. Then it was a trainwreck.,undiscoverable,2018-01-31 19:59:15,1,1,0,0,0,0,0,0
10151472549144999_10151472625819999,5281959998_10151472549144999,10151472549144999_10151472625319999,Perfect.,undiscoverable,2018-01-31 20:00:06,0,0,0,0,0,0,0,0
10151472549144999_10151472771344999,5281959998_10151472549144999,,"Paul, you are a little over the top with your remarks...",undiscoverable,2018-01-31 22:55:01,0,0,0,0,0,0,0,0
10151472549144999_10151472621169999,5281959998_10151472549144999,,"I don’t see a wave of violence by immigrants,  I see a wave of violence by white supremacists!",undiscoverable,2018-01-31 19:53:07,1,1,0,0,0,0,0,0
10151472549144999_10151472807934999,5281959998_10151472549144999,10151472549144999_10151472621169999,Uhhhh. What?,undiscoverable,2018-02-01 00:03:43,0,0,0,0,0,0,0,0
10151472549144999_10151472656919999,5281959998_10151472549144999,,"ILLEGAL, LAW BREAKER, immigrants. They always forget the descriptive adjectives.",undiscoverable,2018-01-31 20:41:11,0,0,0,0,0,0,0,0
10151472549144999_10151472821954999,5281959998_10151472549144999,,"Saying illegal immigrants are a race is not an opinion, it's goofy.",undiscoverable,2018-02-01 00:25:02,0,0,0,0,0,0,0,0
10151472549144999_10151475555619999,5281959998_10151472549144999,,Paul Ryan nodding his head in agreement throughout the event.,undiscoverable,2018-02-03 20:41:10,0,0,0,0,0,0,0,0
10151472549144999_10151472631579999,5281959998_10151472549144999,,8 million people couldn't watch the show.,undiscoverable,2018-01-31 20:09:16,1,1,0,0,0,0,0,0
10151472549144999_10151472616049999,5281959998_10151472549144999,,"Oh, MS-13 is a fantasy?",undiscoverable,2018-01-31 19:45:14,1,1,0,0,0,0,0,0
10151472549144999_10151472574884999,5281959998_10151472549144999,,"out of touch, out of luck nyt",undiscoverable,2018-01-31 18:56:36,12,8,2,0,2,0,0,0
10151472549144999_10151472575754999,5281959998_10151472549144999,10151472549144999_10151472574884999,you out of russia too!,undiscoverable,2018-01-31 18:57:35,1,1,0,0,0,0,0,0
10151472549144999_10151472577179999,5281959998_10151472549144999,10151472549144999_10151472574884999,thank you comrade,undiscoverable,2018-01-31 18:59:17,0,0,0,0,0,0,0,0
10151472549144999_10151472596044999,5281959998_10151472549144999,,Paul is a joke. The guy said US economy would go down with Trump lol.,undiscoverable,2018-01-31 19:22:17,1,1,0,0,0,0,0,0
10151472549144999_10151472581814999,5281959998_10151472549144999,,Truth is truth no matter how bad we choke on it!!,undiscoverable,2018-01-31 19:04:43,0,0,0,0,0,0,0,0
10151472549144999_10151472812719999,5281959998_10151472549144999,,"Crime is racist, I wonder why.",undiscoverable,2018-02-01 00:12:21,0,0,0,0,0,0,0,0
10151472549144999_10151472619049999,5281959998_10151472549144999,,Krugman is an old Lithuanian term for a ripe yeast infection...,undiscoverable,2018-01-31 19:49:31,0,0,0,0,0,0,0,0
10151472549144999_10151472926929999,5281959998_10151472549144999,,"Lovely propaganda, from the ministry of propaganda",undiscoverable,2018-02-01 05:49:20,0,0,0,0,0,0,0,0
10151472549144999_10151472960629999,5281959998_10151472549144999,,You people have lost your minds ! move 2 somewhere else !,undiscoverable,2018-02-01 07:23:02,0,0,0,0,0,0,0,0
10151472549144999_10151472749469999,5281959998_10151472549144999,,"Wrong , stick to market predictions",undiscoverable,2018-01-31 22:18:05,0,0,0,0,0,0,0,0
10151472549144999_10151472591329999,5281959998_10151472549144999,,"Right after STOU, GOP train hit a dumb truck and got derailed. Sadly took one innocent life.",undiscoverable,2018-01-31 19:16:26,0,0,0,0,0,0,0,0
10151472549144999_10151473513389999,5281959998_10151472549144999,,Another provable lie especially when that assrat Drugman pukes it out !,undiscoverable,2018-02-01 16:49:46,0,0,0,0,0,0,0,0
10151472549144999_10151472634184999,5281959998_10151472549144999,,"It doesn’t have to be a wave, there shouldn’t be any because they shouldn’t be here. Imagine having your child murdered and subsequently finding out that it was entirely preventable if we had enforced our laws. The tax paying citizens of this country don’t have a free pass to flout the law, why the hell should illegal aliens enjoy such a right? Zero sympathy.",undiscoverable,2018-01-31 20:12:56,0,0,0,0,0,0,0,0
10151472549144999_10151472618549999,5281959998_10151472549144999,,LEFTIST PROPAGANDIST VOID OF JOURNALISTIC ETHICS!,undiscoverable,2018-01-31 19:48:43,0,0,0,0,0,0,0,0
10151472549144999_10151472729004999,5281959998_10151472549144999,,"Nonsense! Gangs of Hispanics carry out marauding raids throughout New York. Just yesterday a bank and a car dealership on old country road in Carle place were burned to the ground and four Nassau county cops were severely injured.  

Since those events transpired during the State of the Union, the liberal elite media never bothered to report it!",undiscoverable,2018-01-31 21:54:30,0,0,0,0,0,0,0,0
10151472549144999_10151472869159999,5281959998_10151472549144999,,"The wave of VIOLENCE is perpetually perpetrated by AmeriKkkans!!! 
Address THAT!!!",undiscoverable,2018-02-01 02:26:09,0,0,0,0,0,0,0,0
10151472549144999_10151472594844999,5281959998_10151472549144999,,Can we put this loser in a rocket ship? Please...put Krugman in a rocket ship,undiscoverable,2018-01-31 19:20:46,0,0,0,0,0,0,0,0
10151472549144999_10151472641344999,5281959998_10151472549144999,,"Krugman said that the economy would crash and never recover if Trump won. 

That's all you need to know before judging his credibility.",undiscoverable,2018-01-31 20:23:12,0,0,0,0,0,0,0,0
10151472549144999_10151472575719999,5281959998_10151472549144999,,Ask Kate Steinle,undiscoverable,2018-01-31 18:57:33,5,5,0,0,0,0,0,0
10151472549144999_10151472579549999,5281959998_10151472549144999,10151472549144999_10151472575719999,"What about all the other American  women who have been shot by American men  , Tony ??",undiscoverable,2018-01-31 19:02:22,2,2,0,0,0,0,0,0
10151472549144999_10151472582549999,5281959998_10151472549144999,10151472549144999_10151472575719999,Carolyn Stucker whataboutism,undiscoverable,2018-01-31 19:05:54,0,0,0,0,0,0,0,0
10151472549144999_10151472595899999,5281959998_10151472549144999,10151472549144999_10151472575719999,"Quinn Book Take a moment to think ,Quinn !",undiscoverable,2018-01-31 19:22:09,0,0,0,0,0,0,0,0
10151472549144999_10151472577539999,5281959998_10151472549144999,,Liberals whining... Lol,undiscoverable,2018-01-31 18:59:39,4,4,0,0,0,0,0,0
10151472549144999_10151472649984999,5281959998_10151472549144999,,No one knows the State of the Union. Was it mentioned?,undiscoverable,2018-01-31 20:34:27,0,0,0,0,0,0,0,0
10151472549144999_10151474828009999,5281959998_10151472549144999,,Paul krugman- ugly little cretin.,undiscoverable,2018-02-02 23:59:58,0,0,0,0,0,0,0,0
10151472549144999_10151473113304999,5281959998_10151472549144999,,Il Duce Donnie strikes again. Pig.,undiscoverable,2018-02-01 10:21:01,0,0,0,0,0,0,0,0
10151472549144999_10151472651544999,5281959998_10151472549144999,,The book is on the table!,undiscoverable,2018-01-31 20:36:27,0,0,0,0,0,0,0,0
10151472549144999_10151474168264999,5281959998_10151472549144999,,VOTE!,undiscoverable,2018-02-02 10:55:26,0,0,0,0,0,0,0,0
10151472549144999_10151472745084999,5281959998_10151472549144999,,Wow didn’t realize this!,undiscoverable,2018-01-31 22:11:16,0,0,0,0,0,0,0,0
10151472549144999_10151475560919999,5281959998_10151472549144999,,The disgust continues.,undiscoverable,2018-02-03 20:49:55,0,0,0,0,0,0,0,0
10151472549144999_10151472591879999,5281959998_10151472549144999,,This man is pure evil.,undiscoverable,2018-01-31 19:17:16,1,1,0,0,0,0,0,0
10151472549144999_10151472606759999,5281959998_10151472549144999,,More crime by white guys with guns.,undiscoverable,2018-01-31 19:35:06,1,1,0,0,0,0,0,0
10151472549144999_10151472622424999,5281959998_10151472549144999,,#NotMyPresidentNeverEver,undiscoverable,2018-01-31 19:55:49,1,1,0,0,0,0,0,0
10151472549144999_10151472892389999,5281959998_10151472549144999,,Just remember to vote in Nov folks,undiscoverable,2018-02-01 03:40:04,0,0,0,0,0,0,0,0
10151472549144999_10151472854229999,5281959998_10151472549144999,,Paul Ryan's smirk is just as bad.,undiscoverable,2018-02-01 01:40:03,0,0,0,0,0,0,0,0
10151472549144999_10151473436109999,5281959998_10151472549144999,, [[STICKER]],undiscoverable,2018-02-01 15:15:37,0,0,0,0,0,0,0,0
10151472549144999_10151473864204999,5281959998_10151472549144999,,Looks like a tribute photo.,undiscoverable,2018-02-02 01:41:32,0,0,0,0,0,0,0,0
10151472549144999_10151472615659999,5281959998_10151472549144999,,Very disturbed orange creature.,undiscoverable,2018-01-31 19:44:51,0,0,0,0,0,0,0,0
10151472549144999_10151472996594999,5281959998_10151472549144999,,MS13=Welfare Cadillac 2.0,undiscoverable,2018-02-01 08:05:21,0,0,0,0,0,0,0,0
10151472549144999_10151472595784999,5281959998_10151472549144999,,Paul Ryan seems to enjoy it.,undiscoverable,2018-01-31 19:21:56,0,0,0,0,0,0,0,0
10151472549144999_10151472584914999,5281959998_10151472549144999,,The Dotard Fuhrer?,undiscoverable,2018-01-31 19:08:54,0,0,0,0,0,0,0,0
10151472549144999_10151472617284999,5281959998_10151472549144999,,And Stormy Ryan looking so lovingly,undiscoverable,2018-01-31 19:46:27,0,0,0,0,0,0,0,0
10151472549144999_10151472881169999,5281959998_10151472549144999,,i hate the gop stooges,undiscoverable,2018-02-01 03:04:36,0,0,0,0,0,0,0,0
10151472549144999_10151472619894999,5281959998_10151472549144999,,He's PURE EVIL,undiscoverable,2018-01-31 19:50:38,0,0,0,0,0,0,0,0
10151472549144999_10151473228909999,5281959998_10151472549144999,,LMAO. Never read so many stupid comments,undiscoverable,2018-02-01 12:31:53,0,0,0,0,0,0,0,0
10151472549144999_10151473322384999,5281959998_10151472549144999,,Miller wrote the speech,undiscoverable,2018-02-01 13:27:32,0,0,0,0,0,0,0,0
10151472549144999_10151472590194999,5281959998_10151472549144999,,Illegal immigrants!,undiscoverable,2018-01-31 19:14:42,1,1,0,0,0,0,0,0
10151472549144999_10151473744474999,5281959998_10151472549144999,,but was it true,undiscoverable,2018-02-01 22:13:36,0,0,0,0,0,0,0,0
10151472549144999_10151472703094999,5281959998_10151472549144999,,The sky is falling,undiscoverable,2018-01-31 21:35:10,0,0,0,0,0,0,0,0
10151472549144999_10151472616254999,5281959998_10151472549144999,,He pandered to his cult of clowns,undiscoverable,2018-01-31 19:45:19,0,0,0,0,0,0,0,0
10151472549144999_10151472753599999,5281959998_10151472549144999,,Cadet Bone Spurs is evil.,undiscoverable,2018-01-31 22:24:33,0,0,0,0,0,0,0,0
10151472549144999_10151472597349999,5281959998_10151472549144999,,And look at Ryan smirk..,undiscoverable,2018-01-31 19:24:12,0,0,0,0,0,0,0,0
10151472549144999_10151473502224999,5281959998_10151472549144999,,You are full of s***,undiscoverable,2018-02-01 16:36:02,0,0,0,0,0,0,0,0
10151472549144999_10151472625694999,5281959998_10151472549144999,,Ms-13 are great!,undiscoverable,2018-01-31 19:59:48,0,0,0,0,0,0,0,0
10151472549144999_10151472623099999,5281959998_10151472549144999,,He is a scary person.....,undiscoverable,2018-01-31 19:57:05,0,0,0,0,0,0,0,0
10151472549144999_10151472654604999,5281959998_10151472549144999,,"Truly, underlying Evil!",undiscoverable,2018-01-31 20:37:53,0,0,0,0,0,0,0,0
10151472549144999_10151472836189999,5281959998_10151472549144999,,"Yep , evil ! 🐖💩💩💩💩💩💩",undiscoverable,2018-02-01 00:47:04,0,0,0,0,0,0,0,0
10151472549144999_10151472651174999,5281959998_10151472549144999,,Yes. Always Latinos never other groups,undiscoverable,2018-01-31 20:35:58,0,0,0,0,0,0,0,0
10151472549144999_10151472595019999,5281959998_10151472549144999,,He IS truly evil.,undiscoverable,2018-01-31 19:21:00,0,0,0,0,0,0,0,0
10151472549144999_10151472661174999,5281959998_10151472549144999,,He is evil but Gop is as well,undiscoverable,2018-01-31 20:47:19,0,0,0,0,0,0,0,0
10151472549144999_10151472579089999,5281959998_10151472549144999,,These two make me so angry!,undiscoverable,2018-01-31 19:01:48,0,0,0,0,0,0,0,0
10151472549144999_10151472890684999,5281959998_10151472549144999,,Paul is a knob.,undiscoverable,2018-02-01 03:34:50,0,0,0,0,0,0,0,0
10151472549144999_10151472663159999,5281959998_10151472549144999,,Yes evil.,undiscoverable,2018-01-31 20:50:47,0,0,0,0,0,0,0,0
10151472549144999_10151472602154999,5281959998_10151472549144999,,POS-both,undiscoverable,2018-01-31 19:29:53,0,0,0,0,0,0,0,0
10151472549144999_10151472647709999,5281959998_10151472549144999,,Turn in trolls folks,undiscoverable,2018-01-31 20:31:47,0,0,0,0,0,0,0,0
10151472549144999_10151472578989999,5281959998_10151472549144999,,You never disappoint,undiscoverable,2018-01-31 19:01:44,0,0,0,0,0,0,0,0
10151472549144999_10151472657749999,5281959998_10151472549144999,,He is disgusting.,undiscoverable,2018-01-31 20:42:15,0,0,0,0,0,0,0,0
10151472549144999_10151472626699999,5281959998_10151472549144999,,Evil,undiscoverable,2018-01-31 20:01:25,0,0,0,0,0,0,0,0
10151472549144999_10151472599254999,5281959998_10151472549144999,,😕☡,undiscoverable,2018-01-31 19:26:03,0,0,0,0,0,0,0,0
10151472549144999_10151472764144999,5281959998_10151472549144999,,Go Trump! The Man! Tell it like it truly is!,undiscoverable,2018-01-31 22:43:07,0,0,0,0,0,0,0,0
10151472549144999_10151472647629999,5281959998_10151472549144999,,Garland Nixon NYT heard your interview w fox,undiscoverable,2018-01-31 20:31:41,0,0,0,0,0,0,0,0
10151472549144999_10151472663504999,5281959998_10151472549144999,10151472549144999_10151472647629999,I think you're right,undiscoverable,2018-01-31 20:51:46,0,0,0,0,0,0,0,0
10151472549144999_10151472587004999,5281959998_10151472549144999,,"""Fake"" illegal  immigrant crime??????",undiscoverable,2018-01-31 19:10:52,0,0,0,0,0,0,0,0
10151472549144999_10151472607194999,5281959998_10151472549144999,,All of you are nuts,undiscoverable,2018-01-31 19:35:47,0,0,0,0,0,0,0,0
10151472549144999_10151472620444999,5281959998_10151472549144999,,Ugh.,undiscoverable,2018-01-31 19:51:44,0,0,0,0,0,0,0,0
10151472549144999_10151472935504999,5281959998_10151472549144999,,#StopAfrinGenocide,undiscoverable,2018-02-01 06:16:56,0,0,0,0,0,0,0,0
10151472549144999_10151472687039999,5281959998_10151472549144999,,Amen,undiscoverable,2018-01-31 21:24:59,0,0,0,0,0,0,0,0
10151472549144999_10151472692269999,5281959998_10151472549144999,,Bs,undiscoverable,2018-01-31 21:28:13,0,0,0,0,0,0,0,0
10151472549144999_10151472908314999,5281959998_10151472549144999,,😘,undiscoverable,2018-02-01 04:38:06,0,0,0,0,0,0,0,0
10151472549144999_10151472926619999,5281959998_10151472549144999,,Paul Ryan. ..... what a creep,undiscoverable,2018-02-01 05:48:25,0,0,0,0,0,0,0,0
10151472549144999_10151472750644999,5281959998_10151472549144999,,😴😴😴😴😴😴,undiscoverable,2018-01-31 22:20:03,0,0,0,0,0,0,0,0
10151472549144999_10151474267094999,5281959998_10151472549144999,,dont tell me what to do and i tell you who i vote - nah,undiscoverable,2018-02-02 12:52:56,0,0,0,0,0,0,0,0
10151472549144999_10151473401139999,5281959998_10151472549144999,,Yes MS13 is a Salvadorang gang. Like the Yakuza in Japan. The Italian mafia etc.,undiscoverable,2018-02-01 14:39:37,0,0,0,0,0,0,0,0
10151472549144999_10151472591104999,5281959998_10151472549144999,,Democrats=Illegals Before Americans.,undiscoverable,2018-01-31 19:15:56,0,0,0,0,0,0,0,0
10151472549144999_10151472630349999,5281959998_10151472549144999,,"fake immigrant crime wave, really....https://www.reuters.com/article/us-usa-trafficking-arrests/nearly-500-arrested-in-california-human-trafficking-raids-idUSKBN15G5J6",undiscoverable,2018-01-31 20:07:29,0,0,0,0,0,0,0,0
10151472549144999_10151472603244999,5281959998_10151472549144999,,"A tactic used in Nazi Germany. 
https://youtu.be/5LOtPHOnCJc",undiscoverable,2018-01-31 19:31:43,0,0,0,0,0,0,0,0
10151472549144999_10151472754324999,5281959998_10151472549144999,,https://www.youtube.com/watch?v=_4q8x5fR4Sw&t=6s,undiscoverable,2018-01-31 22:25:52,0,0,0,0,0,0,0,0
10151472549144999_10151473350134999,5281959998_10151472549144999,,Yeah.  Here's a nice take on it: https://www.newyorker.com/magazine/2018/02/05/your-grandma-was-a-chain-migrant,undiscoverable,2018-02-01 13:50:57,0,0,0,0,0,0,0,0
10151472549144999_10151472628514999,5281959998_10151472549144999,,For all those who say he is talking about illegal immigrants only.  How do you know an illegal one from a legal? You can only know by asking for papers.  In the mean time we are all treated like illegals.  Regardless of your status.,undiscoverable,2018-01-31 20:03:59,1,1,0,0,0,0,0,0
10151472549144999_10151472745509999,5281959998_10151472549144999,,James Boulton,undiscoverable,2018-01-31 22:11:58,0,0,0,0,0,0,0,0
10151472549144999_10151472612254999,5281959998_10151472549144999,,https://www.facebook.com/RealtimeTrump/videos/790372914491584/?fref=mentions,undiscoverable,2018-01-31 19:41:29,0,0,0,0,0,0,0,0
10151472549144999_10151472584044999,5281959998_10151472549144999,,PS! https://www.facebook.com/dmgpassos/videos/813607242155538/?hc_ref=ARQRJOxFx_hnOrOVmqFtI2mc4NBHcn4MnOKTndDYqSpPVwR2AQ2uzaxoFOsCuLT2JhI,undiscoverable,2018-01-31 19:08:02,0,0,0,0,0,0,0,0
10151472549144999_10151472583429999,5281959998_10151472549144999,,"Donald J. Trump is a blatant racist (among many other wretched things).
Supporting Trump is the equivalent of supporting racism (and many other wretched things).
Therefore, it appears that his supporters are either racists (among other wretched things)...or ignorant victims of gaslighting.
Either way, it’s disgusting.",undiscoverable,2018-01-31 19:07:07,2,2,0,0,0,0,0,0
10151472549144999_10151472760744999,5281959998_10151472549144999,,"He’s disgusting- and as Krugman points out, and all of us in NYC know first hand: immigrants do not engage in violent crime.  Further, almost all of the mass shootings in the US are carried out by Americans with military grade weapons.  Trump and his GOP enablers will take their places along side Joe McCarthy, his evil legal counsel Roy Cohn and their enablers.  Difference is that Trump is POTUS.",undiscoverable,2018-01-31 22:35:15,2,2,0,0,0,0,0,0
10151472549144999_10151472670309999,5281959998_10151472549144999,,"trump's method is to instill fear; he is a fear monger who stirs up racism as part of his plan, too. Doesn't even mention school shootings, Las Vegas, etc., which are far more frightening to me than the ""immigrant violence"" he tries to make us thing is everywhere and is the biggest problem we face. It isn't. How did immigration become such a hot topic now?  White supremacy is my guess. Unless you are 100% Native American, you are an immigrant or descended from an immigrant. Shameful.",undiscoverable,2018-01-31 21:02:29,1,1,0,0,0,0,0,0
10151472549144999_10151472640944999,5281959998_10151472549144999,,"By the way, hispanic is not a race, Spanish is a language.  Mexicans are either white or oriental (the true natives) or a mixture of both.  Brown is not a race either.  So, there goes your racist argument.  If you can rationally discuss a subject just throw a name out there and hope your opponents are stupid enough to accept your lack of logic and decency.",undiscoverable,2018-01-31 20:22:33,0,0,0,0,0,0,0,0
10151472549144999_10151472770914999,5281959998_10151472549144999,10151472549144999_10151472640944999,Idiotic post,undiscoverable,2018-01-31 22:54:05,0,0,0,0,0,0,0,0
10151472549144999_10151472771634999,5281959998_10151472549144999,10151472549144999_10151472640944999,"Yes, well look it up and, of course, don't let facts get in the way of your prejudice or your brain washed ideaology.",undiscoverable,2018-01-31 22:55:30,0,0,0,0,0,0,0,0
10151472549144999_10151473838419999,5281959998_10151472549144999,10151472549144999_10151472640944999,What is your point? I’m not following.,undiscoverable,2018-02-02 00:34:15,0,0,0,0,0,0,0,0
10151472549144999_10151474298744999,5281959998_10151472549144999,10151472549144999_10151472640944999,"You cannot be discriminatory based on a race that doesn't exist.  Another total fabrication by the left, distorting science and history to suit the agenda of the day and create a privileged status based on a non-existent premise.",undiscoverable,2018-02-02 13:42:32,0,0,0,0,0,0,0,0
10151472549144999_10151472621059999,5281959998_10151472549144999,,"We are watching cruelty being institutionalized, aimed at the “least among us” — immigrants. This normalization of hate and racism should be strongly resisted.",undiscoverable,2018-01-31 19:52:58,1,1,0,0,0,0,0,0
10151472549144999_10151472583234999,5281959998_10151472549144999,,"Why didn't the POS talk about the violence by white American males? Specifically,  the gun nuts who continue to slaughter innocent people and children by the dozens?!",undiscoverable,2018-01-31 19:06:42,3,3,0,0,0,0,0,0
10151472549144999_10151472754879999,5281959998_10151472549144999,,"The more he says it, the more some will believe it. It's insidious, and more code speak for demonizing people. Aren't all Americans, except Native Americans, historically immigrants?  Or is it just brown, non Christians, he's really worried about.",undiscoverable,2018-01-31 22:27:17,0,0,0,0,0,0,0,0
10151472549144999_10151473911854999,5281959998_10151472549144999,,"1. ""immigrants"" still lying by omission by excluding the ""illegal"" part of that huh?
2. ""scared of brown people"" because although he's never once said anything like it, you're going to tell people that he believes that because you're the racists who want to accuse others so that you aren't seen for the frauds you are.",undiscoverable,2018-02-02 03:56:08,0,0,0,0,0,0,0,0
10151472549144999_10151472602519999,5281959998_10151472549144999,,"""A lot of Trump’s speech was devoted to lamenting a wave of violent crime by immigrants."" WRONG! A LOT of his speech was spent praising and recognizing American citizens who were invited guests. Pathetic Paul Krugman should be ashamed of  himself for his attempt to sway others to agree with his OPINION! The message was encouraging, patriotic, gracious, and hopeful.",undiscoverable,2018-01-31 19:30:21,1,0,0,0,1,0,0,0
