comment_id,status_id,parent_id,comment_message,comment_author,comment_published,num_reactions,num_likes,num_loves,num_wows,num_hahas,num_sads,num_angrys,num_special
10151472521709999_10151472585664999,5281959998_10151472521709999,,"Don’t ever hug anyone, maybe with written permission? Stay a safe distance away cause people might bump into each other. If a woman flirts with you, get away as fast as you can. If you hear women objectifying men, run away and hide.",undiscoverable,2018-01-31 19:09:45,41,25,2,0,11,0,3,0
10151472521709999_10151472622754999,5281959998_10151472521709999,10151472521709999_10151472585664999,"Lili Uzoma Jacob posted here saying “someone didn’t get enough attention from there mommy or maybe too much.” Another Ad Hominem clichéd post, Then she left.",undiscoverable,2018-01-31 19:56:29,0,0,0,0,0,0,0,0
10151472521709999_10151472626079999,5281959998_10151472521709999,10151472521709999_10151472585664999,"I support your conclusions, Callum Amberson, only because I don't want you or anyone who thinks like you anywhere near my body. So please follow this guide if you are as willfully ignorant as he is. It makes life easier for the adults who understand things like nuance and situational awareness.",undiscoverable,2018-01-31 20:00:41,75,66,6,0,3,0,0,0
10151472521709999_10151472630449999,5281959998_10151472521709999,10151472521709999_10151472585664999,"#Men too, in my case, a male church choir director when I was 9. I pray that sexual torture of women, in all its forms, can be addressed. Women are not even treated fairly in rape trials, the system is wickedly inadequate. Women have been treated abusively thruout human history, more than one can emotionally fathom. It’s the same anger and sorrow that one feels thinking about slavery. Then one thinks of women being made slaves thru most of history. And then today’s continued sexual trafficking of women & children. 

However, One must recognize that false abuse is practiced in both sexual and non-sexual non-gender situations, by both men & women. Hypocrisy and False accusations are evil too, and undermine real and constant abuse of women.",undiscoverable,2018-01-31 20:07:41,0,0,0,0,0,0,0,0
10151472521709999_10151472633959999,5281959998_10151472521709999,10151472521709999_10151472585664999,"Cynthia Arwen Ford I can guarantee you that most men don't wanna be near your body either, so you can sit back and relax.",undiscoverable,2018-01-31 20:12:27,6,4,1,0,0,0,1,0
10151472521709999_10151472634314999,5281959998_10151472521709999,10151472521709999_10151472585664999,"Oh honey, you are gonna go with a personal insult? Please. Prove my point further.",undiscoverable,2018-01-31 20:13:12,21,20,1,0,0,0,0,0
10151472521709999_10151472642474999,5281959998_10151472521709999,10151472521709999_10151472585664999,“Run away and hide”.,undiscoverable,2018-01-31 20:24:30,1,1,0,0,0,0,0,0
10151472521709999_10151472657029999,5281959998_10151472521709999,10151472521709999_10151472585664999,"Callum Amberson, what you went through was truly abhorrent. It shouldn't have happened and it one of the biggest reasons most feminists I know support the stripping away of protection for all predators, regardless of genders involved. Your comments in your original posts were ignorant at best, and severely problematic/phobic. You are better than assuming other victims are making things up.",undiscoverable,2018-01-31 20:41:18,14,14,0,0,0,0,0,0
10151472521709999_10151472670409999,5281959998_10151472521709999,10151472521709999_10151472585664999,"I obviously don’t assume that any victims are making things up, rather the opposite. Perversely, coming forward often comes with punitive stigma.

Yet, I have witnessed, watched so many falsified Setups in completely non-sexual events evidencing that many people lie for all kinds of reasons. False accusation are a corrosive anathema to any human progress.

To kill a Mocking Bird was a favorite movie.",undiscoverable,2018-01-31 21:02:34,1,1,0,0,0,0,0,0
10151472521709999_10151472671809999,5281959998_10151472521709999,10151472521709999_10151472585664999,"This isn't what is being said, in the very least. If your reaction to women wanting to be treated with respect is to not want to deal with them at all, then perhaps you need to reconsider the way you deal with or think of women.

At least, that is the way your initial post comes off as. Your subsequent posts paint a different picture. Lets just suffice it to say that at the end of the day, everyone just wants to be given a basic level of respect.",undiscoverable,2018-01-31 21:04:38,21,18,3,0,0,0,0,0
10151472521709999_10151472680599999,5281959998_10151472521709999,10151472521709999_10151472585664999,Matt Holmes more than a basic level of respect considering the unfathomable mistreatment of women historically ... and honesty ... free of hypocrisy ... free of false accusations. The sexual objectification of others knows no specific gender.,undiscoverable,2018-01-31 21:18:32,0,0,0,0,0,0,0,0
10151472521709999_10151472687459999,5281959998_10151472521709999,10151472521709999_10151472585664999,"Callum Amberson you're right in asking that men also be given the benefit of the doubt. Even so, you seem stunted in your assumption that ""giving a hug"" is appropriate for anyone who hasn't agreed to that kind of treatment. You seem needy... and I get it. I'm not sure of your sexual preference but if you're outlining your interactions with men or women by not bumping into them, giving a hug... and whatever else you sarcastically stated, then you need to dig deeper for acceptance of yourself first.",undiscoverable,2018-01-31 21:25:12,3,3,0,0,0,0,0,0
10151472521709999_10151472750144999,5281959998_10151472521709999,10151472521709999_10151472585664999,Fernando Gamboa cheap shot,undiscoverable,2018-01-31 22:19:18,3,3,0,0,0,0,0,0
10151472521709999_10151472842479999,5281959998_10151472521709999,10151472521709999_10151472585664999,"Callum Amberson research shows it between 2-8% of the time. That means more than 9 out of 10 times, she’s telling the truth. Now act on it.",undiscoverable,2018-02-01 01:02:18,2,2,0,0,0,0,0,0
10151472521709999_10151472861229999,5281959998_10151472521709999,10151472521709999_10151472585664999,"Anne Green, Leeann Tweeden? So you’re playing the imprecise odds with  peoples lives, despite the obvious",undiscoverable,2018-02-01 02:01:24,1,1,0,0,0,0,0,0
10151472521709999_10151472943509999,5281959998_10151472521709999,10151472521709999_10151472585664999,"Callum Amberson yeah men and women do not detain the same level of power in society, proof is that sexual harassment has been going on for ages, everybody knew and yet we are only talking about this now - and yes, men can be molested too but it happens much more rarely for the same reason: women are much less in a position of power. There will always be people lying on both sides, still it's way easier to lie and get away with it if you are a man, hopefully the whole meToo debate will change the way sexual harassment is perceived.",undiscoverable,2018-02-01 06:38:11,4,4,0,0,0,0,0,0
10151472521709999_10151473012504999,5281959998_10151472521709999,10151472521709999_10151472585664999,Is not hugging people that you don't know want to be hugged by you really that hard?,undiscoverable,2018-02-01 08:23:43,1,1,0,0,0,0,0,0
10151472521709999_10151473145834999,5281959998_10151472521709999,10151472521709999_10151472585664999,Mocking the issue isn't helpful and just demonstrates your immaturity,undiscoverable,2018-02-01 11:06:05,1,1,0,0,0,0,0,0
10151472521709999_10151473153564999,5281959998_10151472521709999,10151472521709999_10151472585664999,"Julie Hagigeorges, apparently there is always more room in this thread for more “mocking” & “therapeutic” Ad hominem.",undiscoverable,2018-02-01 11:17:07,0,0,0,0,0,0,0,0
10151472521709999_10151473915029999,5281959998_10151472521709999,10151472521709999_10151472585664999,Fernando Gamboa Personal insults in a debate prove that you are not very intelligent. I assume you are still in middle school and will soon find other ways to express yourself like a big boy.,undiscoverable,2018-02-02 04:05:23,0,0,0,0,0,0,0,0
10151472521709999_10151474150184999,5281959998_10151472521709999,10151472521709999_10151472585664999,"Once I met a nice young woman, who told me about her walking out of a grocery store with a male friend. A bag was thrown over her head and she heard a loud explosion, which she would later learn was that of a fatal gun blast to her male friend’s head. She was kidnapped, taken away, and was raped & sodomized repeatedly by several men for a day.

In time she would bravely testify and put 3 monsters in prison. I have talked about this to a couple of people, In the abstract, who told me that this was a very famous case, and at which art-district grocery store this crime began. 

When I was nine, my church choir director would put his hands down my pajamas, yet this was nothing compared to my friend being tortured, and then toughly, courageously surviving. It all goes beyond one’s comprehension’s pain tolerance.",undiscoverable,2018-02-02 10:30:41,0,0,0,0,0,0,0,0
10151472521709999_10151474197184999,5281959998_10151472521709999,10151472521709999_10151472585664999,"Callum Amberson You straight up need therapy. If not, you’re not going to be a friend to yourself or anyone else.",undiscoverable,2018-02-02 11:32:50,1,0,1,0,0,0,0,0
10151472521709999_10151474208859999,5281959998_10151472521709999,10151472521709999_10151472585664999,"Janis Huneycutt, a completely true story, I thought it was an important one, sorry to offend you with content. 

I’ve got lots of friends, what a pathetic Ad hominem accusation. 

I have been consistently & loudly supported feminist causes my entire life.

More “therapeutic” Ad hominem - Such a cliche on Facebook, and featured in most of your “posts”. What one says .... when apparently one has nothing to say. Does seem that those making the mental offensive are usually describing themselves. Bye, Bye Janis",undiscoverable,2018-02-02 11:44:40,1,0,0,1,0,0,0,0
10151472521709999_10151474217214999,5281959998_10151472521709999,10151472521709999_10151472585664999,"Callum Amberson I can see you're just looking for a place to put your anger. Good luck, get therapy and learn to respect the rest of us. Just because you feel violated, doesn't mean everyone has to humor your neediness. Good riddance, future molester.",undiscoverable,2018-02-02 11:48:27,0,0,0,0,0,0,0,0
10151472521709999_10151474225999999,5281959998_10151472521709999,10151472521709999_10151472585664999,"Lei Smith Magilla Do consider adding content to your “therapeutic” Ad hominem - Does seem that those resorting to the unsolicited “therapeutic” suggestions are often describing themselves and their own therapeutic needs. ... these words are their own, their revealing preferred online jargon. 

Please add some content.

I will continue to strenuously support the #MeToo movement, yet the will call out the #EtTuBrute movement bullying when I see it. 

So sorry, Got to leave the therapy group now, it’s been instructional. bye bye ...

Other internet cheap shots for those posting without content, mix the clichés up ... 

“Put down the crack pipe”

“You must of forgot to take your medications” (“meds” is a dead giveaway of a clinical experience)

“What are your smoking”

“Get help” 

Take your meds (“meds” is a dead giveaway of a clinical experience) 

“Act your age”

“I know you are, but what am I?” 

“How old are you”

“Yeah, well you’re ________ _______ ________?",undiscoverable,2018-02-02 11:59:27,0,0,0,0,0,0,0,0
10151472521709999_10151472861269999,5281959998_10151472521709999,,Sophia  you can always trust world-class “journalism” to shift the focus from women whose voices are just beginning to be heard by turning around and asking men what they think,undiscoverable,2018-02-01 02:01:31,20,19,1,0,0,0,0,0
10151472521709999_10151473053374999,5281959998_10151472521709999,10151472521709999_10151472861269999,Accurate!!!!,undiscoverable,2018-02-01 09:09:15,0,0,0,0,0,0,0,0
10151472521709999_10151473150649999,5281959998_10151472521709999,10151472521709999_10151472861269999,"I agree.  If men have to sort this out , lets not put it center stage.",undiscoverable,2018-02-01 11:12:34,0,0,0,0,0,0,0,0
10151472521709999_10151473202044999,5281959998_10151472521709999,10151472521709999_10151472861269999,So instead of embracing gender equality you are proposing female superiority?,undiscoverable,2018-02-01 12:02:28,1,1,0,0,0,0,0,0
10151472521709999_10151473295149999,5281959998_10151472521709999,10151472521709999_10151472861269999,Yes,undiscoverable,2018-02-01 13:12:37,0,0,0,0,0,0,0,0
10151472521709999_10151473303464999,5281959998_10151472521709999,10151472521709999_10151472861269999,Lmao,undiscoverable,2018-02-01 13:16:05,0,0,0,0,0,0,0,0
10151472521709999_10151473918809999,5281959998_10151472521709999,10151472521709999_10151472861269999,"Marcus Kwan Lol. If there is no equality yet and you allow the people who don't usually get heard to speak, that is creating equality, not superiority.
All your comment shows is that you think women don't actually struggle anymore.",undiscoverable,2018-02-02 04:13:57,1,1,0,0,0,0,0,0
10151472521709999_10151472809264999,5281959998_10151472521709999,,"I am reminded of the movie ""A Day Without a Mexican"", where all the laborers in California disappeared overnight and those previously ""prevailed Gringos” had to do all the manual labor.  I understand the anger of millennium of biological bondage and the rush of sexual liberation, but men are not the enemy and eventually will need to be your partner in shaping the society of tomorrow.  

Men have also been slaves to their biological destinies and have also paid dearly.  Together we can share the burdens of existence and adapt to new social challenges, but be gentle because we both are unraveling centuries of habit and custom.  Men have traditionally taken on some of the most odious tasks of life and largely do so still today.  If you want half the population to shut up and disappear, you may will regret the outcome.  As the old saying goes, ""The gods punish us by granting our prayers.""",undiscoverable,2018-02-01 00:06:04,20,16,1,0,3,0,0,0
10151472521709999_10151472845679999,5281959998_10151472521709999,10151472521709999_10151472809264999,No one is attacking men. Men are being held accountable for their actions. That’s the difference.,undiscoverable,2018-02-01 01:12:37,39,38,1,0,0,0,0,0
10151472521709999_10151472848909999,5281959998_10151472521709999,10151472521709999_10151472809264999,Anne Green people in power are being held accountable. These people happen to be disproportionately men.,undiscoverable,2018-02-01 01:21:56,7,7,0,0,0,0,0,0
10151472521709999_10151472849104999,5281959998_10151472521709999,10151472521709999_10151472809264999,"If that's the message you take from me too (as opposed to, ""women don't want to be assaulted""), I guess you missed the point. Yours is the only comment I've seen talking about men disappearing. Why such hyperbole?",undiscoverable,2018-02-01 01:22:19,27,27,0,0,0,0,0,0
10151472521709999_10151472851309999,5281959998_10151472521709999,10151472521709999_10151472809264999,Well the article was about what men aren't saying. Not saying I completely agree with the guy who posted but yeah.,undiscoverable,2018-02-01 01:28:51,0,0,0,0,0,0,0,0
10151472521709999_10151472851394999,5281959998_10151472521709999,10151472521709999_10151472809264999,"Michael Riv Ello people who’ve abused their power are being held accountable. Yes, they’re mostly men.",undiscoverable,2018-02-01 01:29:08,9,9,0,0,0,0,0,0
10151472521709999_10151472851894999,5281959998_10151472521709999,10151472521709999_10151472809264999,"Leslie Fox desperation.

Gaslighting isn’t working.
Stamping feet saying “this has gone too far” isn’t working.
Threats aren’t working (see above)
I guess playing dumb, as in “I can’t see the difference between assault/harassment/flirting” is the next strategy.

I don’t buy it one bit.",undiscoverable,2018-02-01 01:31:13,22,21,1,0,0,0,0,0
10151472521709999_10151472854184999,5281959998_10151472521709999,10151472521709999_10151472809264999,"Yes, but it's not men per se. This context is with respect to abuse of power.",undiscoverable,2018-02-01 01:39:55,1,1,0,0,0,0,0,0
10151472521709999_10151472855229999,5281959998_10151472521709999,10151472521709999_10151472809264999,Michael Riv Ello correct! There are some women being held accountable as well. See Michigan State President resignation this week.,undiscoverable,2018-02-01 01:42:17,9,9,0,0,0,0,0,0
10151472521709999_10151472856519999,5281959998_10151472521709999,10151472521709999_10151472809264999,"Anne Green thanks I know 👌🏼I see ya commenting about doing household chores and stuff. I see other people on here talking about dating. The movement is about abuse of power. Just wish people would realize the different buckets. Sexual assault where alcohol has been drank by 18 year olds on a college campus is a distinct context from assaults on men and women in various industries as a form of abuse of power. The common thread is acts of a sexual nature, but the mechanisms are different. As far as household chores and dating, they're unrelated to this narrow context of abusing power. 

Bosses should not be hitting on people 20 years younger than themselves... has nothing to do with whether women hate taking out trash or men don't like doing whatever they don't like",undiscoverable,2018-02-01 01:47:07,2,2,0,0,0,0,0,0
10151472521709999_10151472872504999,5281959998_10151472521709999,10151472521709999_10151472809264999,"Michael Riv Ello my comparison was to illustrate the disgusting and shameful of claiming to not know the difference between sexual assault/harassment and dating/flirting.

And yes, while this is about people who abuse their power - whether it be in age, experience, work position, or physical advantage, it would be disingenuous to ignore that most guilty are male.",undiscoverable,2018-02-01 02:35:36,0,0,0,0,0,0,0,0
10151472521709999_10151472914179999,5281959998_10151472521709999,10151472521709999_10151472809264999,"Of course men make #MeToo about them. Sit down, shut up, and listen to us. Take a suggestion or two instead of telling us how wrong we are. Guess what, guys? You don't know what tf you are talking about with this particular issue.",undiscoverable,2018-02-01 05:02:30,9,8,1,0,0,0,0,0
10151472521709999_10151472914319999,5281959998_10151472521709999,10151472521709999_10151472809264999,Anne Green you ROCK!,undiscoverable,2018-02-01 05:03:08,4,3,1,0,0,0,0,0
10151472521709999_10151473014069999,5281959998_10151472521709999,10151472521709999_10151472809264999,"Haha, this one's great.

I was about to delete all men from the earth because it seemed like the only way to stop people from seeing each other as objects of sexual gratification.  Glad I read this before pushing that button.",undiscoverable,2018-02-01 08:25:38,4,4,0,0,0,0,0,0
10151472521709999_10151473041434999,5281959998_10151472521709999,10151472521709999_10151472809264999,Michael Milam haha you’re so amusing yourself,undiscoverable,2018-02-01 08:55:39,1,1,0,0,0,0,0,0
10151472521709999_10151473203664999,5281959998_10151472521709999,10151472521709999_10151472809264999,Seems like people think I'm on this guy's team?  My sarcasm doesn't work that early in the morning I guess,undiscoverable,2018-02-01 12:04:17,0,0,0,0,0,0,0,0
10151472521709999_10151473268959999,5281959998_10151472521709999,10151472521709999_10151472809264999,Michael Milam there's nothing wrong with sexual objectification when you're one-on-one with someone (de Beauvoir). The problem is the systemic objectification of groups of people. Objectification is for the bedroom basically,undiscoverable,2018-02-01 12:56:05,1,1,0,0,0,0,0,0
10151472521709999_10151473327379999,5281959998_10151472521709999,10151472521709999_10151472809264999,"Michael Riv Ello ×
ob·jec·ti·fi·ca·tion
əbˌjektəfəˈkāSH(ə)n/Submit
noun
1.
the action of degrading someone to the status of a mere object.
""the objectification of women as sexual possessions""
2.
the expression of something abstract in a concrete form.
""the objectification of images may be astonishingly vivid in dreams""

It’s not ok to objectify human beings, period.",undiscoverable,2018-02-01 13:31:05,2,1,1,0,0,0,0,0
10151472521709999_10151473426674999,5281959998_10151472521709999,10151472521709999_10151472809264999,Anne Green have you ever read de Beauvoir?? There's a particular definition within her framework and the frame of Sartre. I suggest you read her.,undiscoverable,2018-02-01 15:09:47,0,0,0,0,0,0,0,0
10151472521709999_10151473756989999,5281959998_10151472521709999,10151472521709999_10151472809264999,Michael Riv Ello not my major but I’ll look for the context in which this argument is made.,undiscoverable,2018-02-01 22:28:43,0,0,0,0,0,0,0,0
10151472521709999_10151473843444999,5281959998_10151472521709999,10151472521709999_10151472809264999,"Anne Green yeah you should! It's interesting and, really, shes like the founder of 1st wave (or maybe it's considered 2nd wave actually, I forget)",undiscoverable,2018-02-02 00:48:46,0,0,0,0,0,0,0,0
10151472521709999_10151472553429999,5281959998_10151472521709999,,Easy. Just listen to what women have to say,undiscoverable,2018-01-31 18:27:56,93,81,7,0,5,0,0,0
10151472521709999_10151472571719999,5281959998_10151472521709999,10151472521709999_10151472553429999,"Ew, as if.",undiscoverable,2018-01-31 18:52:24,2,1,1,0,0,0,0,0
10151472521709999_10151472607114999,5281959998_10151472521709999,10151472521709999_10151472553429999,like they will actually tell you.,undiscoverable,2018-01-31 19:35:40,8,7,0,0,0,0,1,0
10151472521709999_10151472634464999,5281959998_10151472521709999,10151472521709999_10151472553429999,"“You know what is happening to me” and then a b*tch face. So no, it’s not that simple.",undiscoverable,2018-01-31 20:13:27,3,3,0,0,0,0,0,0
10151472521709999_10151472807574999,5281959998_10151472521709999,10151472521709999_10151472553429999,"Different women say different things. Some women have said I'm too nice. A couple women have told me not to ask girls to dance at a club but to just start dancing on them. I shall err on the side of caution, but don't act like all women are all telling all men to act in one simple way. It's complicated.",undiscoverable,2018-02-01 00:02:53,8,8,0,0,0,0,0,0
10151472521709999_10151473913159999,5281959998_10151472521709999,10151472521709999_10151472553429999,Omari Christian Stay Home.,undiscoverable,2018-02-02 03:59:15,0,0,0,0,0,0,0,0
10151472521709999_10151475056849999,5281959998_10151472521709999,10151472521709999_10151472553429999,"Omari Christian It's almost as if women are unique individuals who don't all think alike. Hence, what Murray said is correct, listen. Listen to the individuals. Listen to women, not as a collective, but as individual people because that is what we are. Yes, amazing, isn't it? Different women say different things just like different men say different things.",undiscoverable,2018-02-03 09:36:22,2,2,0,0,0,0,0,0
10151472521709999_10151475575789999,5281959998_10151472521709999,10151472521709999_10151472553429999,"Omari Christian That's the point. You check in with whomever you're with to see if they are comfortable, rather than making assumptions. And if you're told off, you stop. People make mistakes, and we all cross boundaries sometimes without realizing. What matters is that you're aware of that and that you respect individual people's boundaries. It's a basic social skill, and we do it all the time when we talk to people.",undiscoverable,2018-02-03 21:14:53,1,1,0,0,0,0,0,0
10151472521709999_10151476015269999,5281959998_10151472521709999,10151472521709999_10151472553429999,Jade Jameson Thanks. That's fair. (Not responding to Veronica because she thinks sarcasm is warranted).,undiscoverable,2018-02-04 14:14:22,0,0,0,0,0,0,0,0
10151472521709999_10151472952139999,5281959998_10151472521709999,,"""One man, a former human-resources director, said he was reported for harassment in the ‘90s — unfairly, he believed — when he told a female colleague that “You were in my dream last night.” He didn’t mean it sexually, he said.""

It is interesting that the paragraph following this one describes the men discussing and identifying with Aziz Ansari.

Dude was bewildered when a woman couldn't read his mind. Remains indignant about it twenty years later. Identifies with a man who got in trouble for supposedly ""not being a mind reader"".",undiscoverable,2018-02-01 07:02:18,8,8,0,0,0,0,0,0
10151472521709999_10151472696704999,5281959998_10151472521709999,,"I just appreciate the dialogue being had regardless of relevant circumstances or events. 
This is history.",undiscoverable,2018-01-31 21:30:46,13,13,0,0,0,0,0,0
10151472521709999_10151473526369999,5281959998_10151472521709999,,It's rather amusing to me that I can so easily tell by their comments which men on here are upset that they can no longer get away with their past bad behavior. It's also heartening to read the comments of men who are thoughtful and understanding. I guess all men feel that sometimes they are pushed around by a woman. But the men who have the guts to admit that kind of pushing is nothing compared to what women go through are the men I admire.,undiscoverable,2018-02-01 17:06:28,8,7,1,0,0,0,0,0
10151472521709999_10151472722024999,5281959998_10151472521709999,,"Seriously guys, treat a woman with respect and if she tells you No ..... pull your zipper up and if you don't like it...don't date her again. Simple.",undiscoverable,2018-01-31 21:48:58,10,9,1,0,0,0,0,0
